cdmSourceName,sourceDescription
LPD Australia,"IQVIA(R) LPD in Australia is a longitudinal patient database providing anonymized information from continuing physician and patient interaction on consultations, diagnoses and treatment within Primary Care. Data are delivered by 900 office based doctors in Australia. The contents of the database document the management of patients by General Practitioners and specialists and include comprehensive records of diagnosis information; the management of the diagnosis, be it prescription issues, hospital admission or other tertiary care; specialist referrals; laboratory test results and administrative activities.  Prescriptions, issued by GPs using either the generic substance or drug name are captured exactly as written, including information on indication, dose, strength and dosage instruction and cost.  "
Merative MarketScan® Commercial Claims and Encounters Database,"The Merative(R) MarketScan(R) Commercial Database (CCAE) includes health insurance claims across the continuum of care (e.g. inpatient, outpatient, outpatient pharmacy, carve-out behavioral healthcare) as well as enrollment data from large employers and health plans across the United States who provide private healthcare coverage for employees, their spouses, and dependents. This administrative claims database includes a variety of fee- for-service, preferred provider organizations, and capitated health plans."
France Disease Analyzer,"France DA dataset contains office visits, prescribed medications and vaccinations, test results and diagnosis (ICD10)."
Merative MarketScan® Multi-State Medicaid Database,"The Merative(R) MarketScan(R) Multi-State Medicaid Database (MDCD) reflects the healthcare service use of individuals covered by Medicaid programs in numerous geographically dispersed states. The database contains the pooled healthcare experience of Medicaid enrollees, covered under fee-for-service and managed care plans. It includes records of inpatient services, inpatient admissions, outpatient services, and prescription drug claims, as well as information on long-term care. Data on eligibility and service and provider type are also included. In addition to standard demographic variables such as age and gender, the database includes variables such as federal aid category (income based, disability, Temporary Assistance for Needy Families) and race."
Merative MarketScan® Medicare Supplemental and Coordination of Benefits Database,"The Merative(R) MarketScan(R) Medicare Supplemental Database (MDCR) represents the health services of retirees in the United States with Medicare supplemental coverage through employer-sponsored plans. This database contains primarily fee-for-service plans and includes health insurance claims across the continuum of care (e.g. inpatient, outpatient and outpatient pharmacy)."
Optum’s  Clinformatics® Extended Data Mart – Date of Death (DOD),"Optum’s Clinformatics® Data Mart (CDM) is derived from a database of administrative health claims for members of large commercial and Medicare Advantage health plans.  Clinformatics® Data Mart is statistically de-identified under the Expert Determination method consistent with HIPAA and managed according to Optum® customer data use agreements. CDM administrative claims submitted for payment by providers and pharmacies are verified, adjudicated and de-identified prior to inclusion. This data, including patient-level enrollment information, is derived from claims submitted for all medical and pharmacy health care services with information related to health care costs and resource utilization. The population is geographically diverse, spanning all 50 states."
Optum EHR,"Optum’s longitudinal EHR repository is derived from dozens of healthcare provider organizations in the United States, that include more 57 contributing sources and 111K sites of care. The data is certified as de-identified by an independent statistical expert following HIPAA statistical de-identification rules and managed according to Optum® customer data use agreements3,4 . Clinical, claims and other medical administrative data is obtained from both Inpatient and Ambulatory electronic health records (EHRs), practice management systems and numerous other internal systems. Information is processed, normalized, and standardized across the continuum of care from both acute inpatient stays and outpatient visits. Optum® data elements include demographics, medications prescribed and administered, immunizations, allergies, lab results (including microbiology), vital signs and other observable measurements, clinical and inpatient stay administrative data and coded diagnoses and procedures. In addition, Optum® uses natural language processing (NLP) computing technology to transform critical facts from physician notes into usable datasets. The NLP data provides detailed information regarding signs and symptoms, family history, disease related scores (i.e. RAPID3 for RA, or CHADS2 for stroke risk), genetic testing, medication changes, and physician rationale behind prescribing decisions that might never be recorded in the EHR."
Japan Medical Data Center (JMDC),"JMDC database consists of data from more than 250 Health Insurance Associations covering workers aged less than 75 and their dependents. The proportion who are younger than 66 years old in JMDC is approximately the same as the proportion in the whole nation.  JMDC data includes data on membership status of the insured people and claims data provided by insurers under contract.  Claims data are derived from monthly claims issued by clinics, hospitals and community pharmacies.  The size of JMDC population is about 10% of people in the whole nation."
